{
  "apiVersion": "platform.tangri/v1alpha1",
  "kind": "EdgeVM",
  "metadata": { "name": "tangri-edge-tier-1", "tier": "tier-1" },
  "hardware": {
    "architectures": ["amd64", "arm64"],
    "accelerator": { "required": false, "type": "none" }
  },
  "vm": {
    "vcpus": 2,
    "memoryMiB": 4096,
    "diskGiB": 32,
    "persistentDataGiB": 16
  },
  "networks": {
    "northbound": { "enabled": true, "dhcp": true },
    "southbound": { "enabled": true, "isolated": true }
  },
  "image": {
    "uri": "REPLACE_WITH_SIGNED_TANGRI_EDGE_IMAGE",
    "digest": "sha256:0000000000000000000000000000000000000000000000000000000000000000"
  },
  "passthrough": []
}
